Duration (in seconds),LocationLatitude,LocationLongitude,AW_1,AW_2,AW_3,AW_4,AW_5,ATT_1,ATT_2,ATT_3,USE_1,USE_2,USE_3,USE_4,USE_5,SE_1,SE_2,SE_3,PENJ_1,PENJ_2,PENJ_3,PENJ_4,PE_1,PE_2,PE_3,PE_4,PE_5,PE_6,EE_1,EE_2,EE_3,EE_4,PR_1,PR_2,PR_3,PR_4,SI_1,SI_2,SI_3,SI_4,FC_1,FC_2,FC_3,FC_4,BI_1,BI_2,BI_3,Age,Gender,Education,Field_Teaching,Text_Field,Experience,Open_ended,Q19
743,39.9664,-75.1685,4,4,2,4,4,4,3,3,3,2,3,2,3,3,3,3,3,3,4,4,3,3,3,3,3,3,3,3,2,2,3,3,3,3,3,3,2,3,3,2,2,2,3,3,3,4,2,4,3,,5,Depends upon how I useit,4
250,46.0367,-73.0588,4,4,3,3,4,4,3,3,4,3,3,4,3,4,3,3,4,3,3,4,3,4,3,3,3,4,3,4,4,3,4,3,3,4,4,3,3,3,2,3,3,3,2,3,3,1,1,2,7,,2,Pheraps,2
259,39.7458,-75.581,4,5,5,4,5,5,4,3,4,5,4,4,5,5,3,4,5,4,5,4,5,4,5,2,5,4,5,4,4,4,4,2,4,5,4,3,5,1,4,4,5,4,5,4,3,2,1,1,3,,3,I think it should be used as a source to help with papers but not used cheat ,2
415,43.6859,-79.3974,5,4,4,5,5,4,4,4,3,3,3,3,3,4,4,4,4,4,4,4,4,4,4,3,4,5,4,4,4,4,2,4,5,4,2,2,2,2,4,2,4,4,4,4,4,2,1,2,2,,3,It's something they are interested in and it shows that we are educators understand the technology and are still relevant.,4
436,45.5397,-122.9638,5,5,4,5,5,4,4,5,5,4,4,5,4,5,4,5,5,5,5,4,5,4,4,5,4,4,5,5,4,3,3,4,3,5,5,4,5,4,4,5,5,5,4,3,5,1,1,2,3,,3,Ai helps students be much more efficient in completing tasks and assignments.,1
162,40.6286,-73.939,5,4,3,4,4,5,4,3,4,3,2,4,4,5,4,3,4,3,5,5,4,3,2,5,5,4,4,5,3,4,5,3,2,4,4,5,3,4,5,4,3,4,5,3,4,1,1,1,5,,2,It will speed up the learning process,3
339,45.4169,-73.5006,3,2,2,2,3,5,2,2,1,1,1,1,1,4,4,3,2,2,2,2,3,3,3,3,2,2,1,1,1,1,5,5,5,5,2,2,2,2,1,3,4,4,2,2,3,2,2,3,9,,1,not sure in my field,4
317,46.0509,-71.944,4,3,5,5,3,4,3,5,4,5,3,4,5,3,4,5,5,4,4,5,4,5,4,5,5,4,4,5,5,4,5,4,5,5,4,4,5,5,4,5,4,5,5,5,4,2,1,2,3,,5,OK FOR ME.,1
227,45.5152,-122.4167,4,3,2,3,4,2,3,4,4,3,2,3,4,2,3,4,4,3,2,3,4,3,2,3,4,3,2,3,4,3,4,3,2,3,4,3,2,3,4,3,2,3,2,3,4,3,1,1,3,,4,I'm not sure,3
149,45.5934,-73.6418,5,5,4,5,5,4,5,5,4,3,3,4,3,4,4,5,4,5,4,4,5,5,4,5,4,4,5,4,4,3,4,2,2,2,4,4,5,4,5,4,4,5,5,4,5,1,2,1,4,,3,Do the repetitive tasks so I can focus more on the content,2
383,45.4995,-73.5848,5,3,3,5,5,4,3,3,1,1,1,1,1,5,5,5,2,3,3,3,3,3,2,3,3,3,5,5,5,5,5,5,5,5,3,2,1,1,5,5,5,5,2,3,1,2,2,4,1,,4,I don’t believe  it will.,4
504,49.1788,-97.9404,4,4,4,5,5,3,4,4,3,3,4,4,3,5,5,5,4,4,4,4,5,4,5,4,4,5,4,4,4,4,3,3,2,3,4,4,4,4,4,4,5,5,4,5,4,1,2,2,3,,4,I think students are interested in AI and they find it stimulating. It would make learning more fun and they will retain their focus longer,1
153,39.9216,-82.8664,5,4,5,4,5,5,4,5,5,4,5,4,5,5,4,5,5,4,5,5,5,4,5,5,4,5,5,4,5,5,5,5,5,4,5,4,5,4,5,4,5,5,5,4,5,3,1,2,2,,3,make learning fun ,3
283,41.7431,-72.6827,1,1,1,1,1,4,4,4,4,4,4,4,4,4,4,4,4,4,4,4,4,4,4,4,4,4,4,4,4,5,4,3,3,4,4,4,4,3,4,4,4,4,4,4,4,1,2,1,8,,3,"I do think that using generative AI tools in my teaching, can enhance student engagement in the classroom because it will help students to get automatic answers and details.",3
277,38.581,-121.4939,4,4,4,4,4,3,3,3,2,2,3,2,3,4,4,4,3,3,3,3,4,4,4,4,4,4,3,3,3,3,4,4,4,3,2,2,3,3,4,4,4,4,3,3,3,2,1,4,2,,5,Providing more intellectual information ,3
492,41.573,-75.4019,3,4,3,3,4,3,4,3,1,1,1,1,1,2,2,2,3,3,4,3,4,4,3,4,3,3,2,2,3,2,4,4,4,4,4,4,3,3,2,2,1,4,4,4,4,3,1,2,7,,5,It will take some work as many of my students aren't pc literate. I think most students will embrace it though so that they stay on top of their game.,4
310,37.3031,-78.409,4,4,4,4,5,2,2,1,1,1,1,1,1,4,2,2,1,1,1,1,1,1,1,1,2,1,4,4,3,4,4,5,5,5,1,2,3,1,2,2,4,4,1,1,1,2,1,4,1,,5,It can't -- I teach Creative Writing.,1
518,43.709,-79.4057,5,5,5,5,5,5,5,5,5,5,5,5,4,5,5,5,5,5,4,5,5,5,5,5,5,5,5,5,5,2,3,4,3,4,5,5,5,5,5,5,5,5,5,5,5,2,2,2,1,,5,They help students be more creative ,1
663,46.925,-71.3995,4,4,5,4,5,1,1,1,1,1,1,1,1,5,2,2,1,1,1,1,1,1,2,1,1,1,4,3,3,2,5,5,5,5,1,1,1,1,2,2,2,2,1,1,1,1,1,1,3,,3,"I don't think it is the capacity to enhance it, but just to make it worst",1
336,40.8596,-73.9316,5,4,4,5,5,4,2,2,3,2,4,1,3,5,5,5,4,5,5,2,4,2,1,4,5,4,5,5,5,5,5,5,5,5,3,3,4,4,5,5,5,5,2,2,1,1,2,1,6,,1,It would make things too simple for them,4
254,42.2904,-71.0712,5,5,5,5,5,5,5,5,4,4,4,5,4,5,4,4,5,5,4,5,5,5,4,5,5,5,5,5,5,1,1,1,2,1,5,5,3,5,5,5,5,5,5,5,5,2,1,3,3,,5,They will save us time and money I feel it will be very beneficial ,1
433,40.6832,-76.2113,4,4,4,4,4,3,3,4,3,3,2,3,3,4,4,5,2,4,4,2,4,2,4,2,2,3,4,4,4,3,5,5,5,5,2,3,4,2,4,4,3,3,3,2,3,1,2,2,4,,3,I think it would harm not help engagement ,4
256,50.4084,-104.6526,5,3,4,3,3,4,4,2,4,4,3,5,4,4,3,4,4,4,2,2,4,3,4,3,3,4,4,4,3,4,4,2,4,4,4,4,2,4,4,4,4,4,4,4,4,1,1,4,4,,2,By using tools and methods that enhance their engagement ,4
291,37.3371,-79.2815,5,5,4,5,4,2,5,4,4,4,4,3,4,4,5,5,5,5,4,4,4,5,5,4,5,5,4,4,5,4,2,2,1,3,4,4,5,4,4,5,5,4,5,4,5,1,1,3,4,,4,It can give them a clearer picture of the curriculum ,2
214,36.3402,-79.6622,5,5,5,5,5,5,5,5,5,4,3,4,5,5,5,5,5,5,5,5,4,4,5,4,5,5,4,5,4,4,1,4,4,4,5,4,4,4,4,5,4,4,4,4,5,2,2,3,7,,4,It could bring out more involvement within the social community,4
332,32.8679,-80.0468,4,5,4,4,5,5,4,4,3,3,4,3,4,5,4,4,5,5,4,4,5,4,4,4,3,4,3,4,4,5,5,5,3,4,2,4,3,3,4,3,4,4,4,3,5,1,1,1,4,,2,I think that the use of AI will enhance my teachings by allowing more information and accuracy in multiple areas at the same time through quick processing than the brain.,3
325,47.6901,-122.3747,5,4,5,5,5,5,5,4,4,4,5,4,4,4,5,4,4,4,5,5,5,4,4,5,4,5,5,4,4,2,5,3,4,5,4,5,4,5,4,4,4,5,4,5,5,2,1,1,4,,4,Orcale,2
277,34.1438,-117.2548,5,5,5,5,5,5,5,5,4,4,4,4,4,5,5,5,5,5,5,5,5,5,5,5,5,5,5,5,5,3,4,2,4,4,5,5,5,5,4,5,5,5,5,5,5,3,1,2,2,,5,It is an additional education tool to be utilized to help engage learning ,1
167,43.2642,-79.9143,5,4,2,4,3,4,5,4,4,5,4,5,5,4,5,4,4,5,4,5,5,4,4,5,4,4,5,4,5,4,4,5,4,4,5,4,4,5,5,4,3,4,5,4,3,1,1,3,5,,3,It can show kids new ways to do stuff. ,1
156,33.1909,-96.6198,4,3,3,4,4,5,4,5,5,5,4,4,3,5,4,3,4,4,4,3,5,5,4,4,3,5,5,4,4,5,4,2,4,5,5,4,3,3,5,3,4,4,5,4,4,1,1,1,4,,3,It Will help a lot and more,1
686,32.3886,-86.1691,1,2,5,5,5,5,4,4,5,3,4,5,4,4,5,4,4,5,4,5,4,5,5,4,5,5,4,4,5,4,5,4,5,4,5,4,5,4,4,5,5,5,4,5,4,2,2,1,4,,2,i love it,3
405,44.6283,-63.5928,4,4,3,4,5,3,4,4,2,3,3,1,4,5,4,4,3,4,5,3,3,4,3,3,5,4,2,2,2,2,5,5,5,5,4,4,3,3,2,2,3,4,4,4,3,3,1,4,2,,5,"Students are enthusiastic about AI, so I believe I must harness and direct that enthusiasm toward productive outcomes. ",1
182,28.5177,-81.4508,5,4,4,5,4,4,5,5,4,5,4,4,4,5,5,4,5,5,5,4,5,5,5,5,5,4,5,5,5,5,5,5,5,5,5,4,4,4,4,5,5,5,5,4,5,1,1,2,1,,4,It helps me build a better understanding,4
448,39.9357,-75.1832,4,4,3,2,5,2,2,3,1,1,3,1,3,4,4,3,3,4,3,2,3,2,2,2,1,3,4,4,4,5,3,5,5,4,2,2,2,1,4,3,3,4,2,3,2,1,2,1,1,,2,Ai could possibly be useful for formatting lessons in ways that are less straining or more interesting to the minds of students.,3
316,45.6128,-73.6186,3,2,2,3,2,2,4,4,3,4,3,3,3,4,5,5,4,5,5,5,3,4,4,4,4,4,4,4,4,4,4,4,4,3,3,4,3,3,3,4,4,5,3,5,5,1,2,,11,,1,Kids love technologie that would be a great start to get their intentions.,4
171,49.1836,-123.1164,2,2,2,3,2,2,3,2,5,2,3,2,2,3,2,2,2,3,2,3,2,2,3,2,2,2,2,3,2,3,2,3,2,2,2,3,2,4,2,3,2,2,3,2,3,2,2,4,4,,4,Im not planning on using it ,1
433,44.4312,-81.386,2,2,2,2,2,4,4,4,2,2,2,2,2,3,3,3,3,3,3,4,4,4,4,3,3,3,3,3,3,3,4,3,3,4,3,2,2,2,1,1,1,1,3,4,4,1,2,,11,,4,I am not sure yet since I haven't had the chance to explore it.,3
469,45.5708,-73.6529,4,5,4,5,3,4,5,5,5,4,5,5,4,4,5,4,4,5,3,4,4,4,5,3,2,5,4,5,4,5,3,3,4,1,2,3,3,4,3,4,3,4,3,2,3,1,1,2,2,,4,It would save alot of time and it will give more info quicker,1
173,41.7697,-87.6985,3,3,2,2,3,4,4,2,1,1,1,1,2,4,3,4,3,4,4,4,4,3,4,3,4,4,3,3,4,5,4,3,4,5,4,4,4,4,4,3,3,4,4,4,5,1,2,2,3,,3,None ,3
425,53.7121,-122.8568,4,5,4,3,4,5,5,5,3,1,3,1,4,4,3,4,5,5,5,5,5,5,5,4,4,5,4,5,5,4,4,2,2,4,2,2,2,2,2,1,4,2,5,5,4,1,1,2,2,,2,"it is no different then levergaing the internet. Students will still have to think creatively and learn to analyze, they just have more computiong power now. They will be able to find more tailored information. They will still need to verify it for factual reporting.",2
162,40.0711,-75.2051,5,4,5,4,4,5,4,4,5,4,5,4,5,5,5,5,5,4,4,5,4,4,5,4,5,4,5,5,4,5,5,4,5,5,4,5,4,5,5,4,4,4,5,4,5,1,1,1,2,,4,They can help to clarify answers and do research ,1
532,43.64,-79.433,4,4,4,4,4,5,5,4,3,3,4,3,4,3,4,4,4,4,4,4,4,4,3,4,4,4,4,4,5,4,3,4,4,4,3,4,2,2,2,2,2,3,4,4,5,1,2,1,4,,1,By providing a fresh perspective of teaching experience ,4
659,49.8882,-97.1794,4,4,4,4,4,3,3,3,4,3,3,4,2,4,3,4,3,4,5,3,4,4,4,5,3,3,3,3,3,2,4,5,5,5,2,2,2,2,3,2,3,3,4,4,4,1,1,4,1,,3,"Generative AI provides opportunities for student to improve their own writing by critiquing AI outputs, particularly regarding fabricated information and attributions as well as detecting bias",4
421,39.1164,-77.7802,4,3,4,4,4,4,4,4,3,4,3,3,4,4,3,4,4,5,4,4,4,4,4,4,4,4,3,3,3,2,4,4,4,4,3,4,3,3,4,2,4,4,4,4,4,2,1,2,1,,5,We live in a society that expects immediacy and Generative AI tools help provide that. ,1
875,25.9436,-80.2264,5,5,4,3,2,5,1,5,5,3,4,5,3,5,5,4,3,4,5,3,5,2,1,3,4,5,4,4,4,2,5,5,2,5,5,3,5,5,5,2,3,4,5,3,3,2,1,1,2,,2,It will allow students to open up more with confidence ,3
209,45.5154,-73.5822,4,4,3,4,5,3,3,4,2,3,3,2,2,3,4,4,4,4,3,4,5,4,4,3,3,4,3,4,3,2,4,3,4,4,4,4,3,4,4,4,3,4,2,3,4,1,1,3,4,,3,,1
215,33.9249,-117.4592,4,4,4,4,5,2,2,2,2,2,2,1,2,5,4,5,3,3,2,2,2,2,2,2,3,3,4,4,5,5,4,4,5,5,4,3,1,1,4,2,4,4,1,1,1,1,1,4,4,,4,Generative AI tools would actually detract from the engineering material I teach and would not encourage student motivation and original creative and critical thinking,1
299,40.7297,-73.8163,4,4,4,4,4,5,4,3,3,4,5,3,4,4,3,5,5,4,5,3,3,4,2,5,5,3,2,3,2,4,4,5,2,1,3,1,5,4,5,4,4,3,3,2,3,2,1,1,3,,3,yes most definatly,4
283,43.6426,-79.4002,2,2,2,2,1,2,1,1,3,3,4,4,4,4,4,4,4,4,3,3,4,4,4,4,4,4,3,3,4,2,5,4,5,4,3,3,4,3,3,2,3,4,4,4,4,1,1,4,6,,2,Overall students should benefit from the new technology however there needs to be a limit in which how much we rely on these technologies ,2
261,41.2581,-95.9325,4,4,4,4,4,4,4,4,3,3,3,2,3,4,4,4,4,4,4,4,4,4,4,4,4,4,4,4,4,3,5,4,4,3,3,3,3,3,4,4,4,4,4,4,4,1,1,1,5,,3,It can help cut down the time to research and come up with new ideas ,1
488,26.9146,-82.0559,5,4,5,4,5,5,4,5,4,5,4,4,5,5,4,4,5,4,5,4,5,4,4,5,4,5,5,4,4,2,2,4,5,4,5,4,4,5,5,4,5,4,5,4,5,1,2,2,4,,5,We can improve the speed and accuracy of retrieving teaching materials in teaching.,1
315,45.4915,-73.3989,4,5,4,4,5,4,5,4,5,4,3,4,4,5,4,4,4,5,4,4,5,4,4,5,4,5,5,4,3,4,5,4,4,4,5,4,4,5,5,4,4,5,4,5,4,1,1,3,4,,2,BY INTERGRATING IN OUR CURRICULUM,1
739,29.5183,-95.0977,5,5,4,4,5,5,4,5,4,2,4,5,5,5,5,4,5,5,4,5,5,4,5,5,5,5,5,4,4,1,5,4,5,2,5,4,5,5,5,4,5,4,5,5,5,1,2,3,4,,5,"AI can produce resources like exercises, examples, questions, quizzes, and eBooks. Accessing a variety of learning materials can help students enhance their comprehension and engagement.",1
187,43.8678,-79.442,4,4,5,4,4,4,4,4,4,5,4,4,3,4,3,4,4,3,4,4,3,2,3,3,4,3,4,3,2,4,4,4,5,3,4,4,3,3,4,1,4,4,3,3,4,2,1,4,4,,3,"Good,",1
447,37.0453,-76.3404,4,4,4,4,4,3,4,4,1,1,4,1,4,4,3,4,3,5,5,3,4,4,5,3,4,5,4,4,4,3,4,5,5,4,1,1,1,1,3,1,3,3,1,1,1,3,2,2,7,,5,"For weekly announcements. To  help understand directions, rubrics, and assignments. ",4
440,41.945,-87.7996,5,5,5,5,5,4,5,5,4,4,5,4,5,5,5,5,5,5,5,5,5,5,5,5,5,5,5,5,5,5,5,4,4,4,5,5,5,5,5,5,5,5,5,5,5,2,1,4,4,,5,Make it easier for them to comprehend complex things,1
298,36.122,-115.086,4,5,4,5,4,4,4,4,4,3,3,3,3,5,5,4,4,4,3,4,5,4,4,5,4,4,4,4,4,3,4,4,2,4,2,4,3,3,4,4,4,3,4,4,4,2,1,2,2,,4,I use it for related topics and readings.,1
413,35.7767,-90.7694,5,5,5,5,4,5,5,5,5,5,5,5,5,5,5,5,5,5,5,5,5,5,5,5,5,5,5,4,5,4,4,1,1,1,3,4,3,2,5,1,5,4,5,5,5,2,1,3,1,,5,"Help with organizatio, research, fact checking, prioritization, suggestions, common and novel current practices",1
644,41.6244,-93.6694,4,4,4,4,4,4,5,5,4,4,4,4,4,4,4,4,4,5,4,4,4,4,4,4,4,4,4,4,4,2,4,4,4,4,3,3,2,3,3,2,2,2,4,4,4,3,1,2,1,,5,"Students love AI tools. They instantly become engaged when it is mentioned that AI tools are involved with the lesson/topic. The novelty may not last long, but currently students are eager to be involved with AI tools in the classroom.",4
236,40.7143,-111.8894,5,4,4,5,4,5,4,4,3,3,4,2,4,5,5,4,5,5,4,4,5,5,5,4,4,5,4,4,5,3,2,3,1,2,4,5,4,4,4,4,5,5,5,5,5,1,1,2,7,,2,I feel like it can really help me study and learn more about what I need to do and how it can help me ,3
320,45.3004,-75.9213,4,4,4,4,4,5,5,4,3,4,4,4,5,5,5,5,5,5,5,5,4,5,5,5,4,4,4,4,4,2,2,5,5,4,4,4,4,5,4,3,4,5,5,5,5,1,1,2,2,,4,I think it will allow me to reasearch and find information far more easily which will allow me to portray information quickly and accurately to my students.,1
216,41.7697,-87.6985,2,2,3,4,4,3,2,4,4,4,3,3,3,4,3,2,2,2,2,2,4,3,2,1,3,3,3,4,4,4,4,4,4,4,3,4,4,4,3,3,4,3,3,2,4,3,1,2,3,,4,Yes i do,3
390,42.2593,-84.7656,2,2,1,1,2,3,3,3,1,1,1,2,2,2,2,2,4,4,3,3,3,3,3,3,3,4,4,3,4,2,3,3,3,4,2,2,3,2,1,2,2,3,3,4,3,1,2,2,1,,3,I think the idea of new technology excites anyone ,4
294,37.7825,-122.435,2,2,3,3,1,4,4,3,3,4,2,3,3,2,2,3,2,2,2,2,3,4,3,4,3,4,2,2,3,3,1,3,4,4,3,3,2,4,4,4,3,4,2,2,3,1,1,3,5,,3,I think it’s cool to use AI as a tool to help preparing teaching materials. The thing I most concern about is that students may start rely more on the AI to the help them learning which would decrease the engagement and become a passive learning style as suppose to an active learning style. ,2
175,43.7032,-79.5293,5,5,5,5,5,5,5,5,5,5,5,5,5,5,5,5,5,5,3,3,5,4,3,4,5,4,4,3,4,3,5,4,4,4,4,3,5,4,4,3,3,4,4,5,3,1,2,2,2,,2,I like them,1
259,47.8302,-122.3331,5,4,4,5,4,5,3,5,2,1,1,1,4,4,4,4,4,5,4,4,5,4,4,5,5,5,5,4,4,5,5,5,5,5,2,1,2,1,2,2,4,4,4,5,5,1,2,3,4,,3,I think the use of Generative AI tools can increase student creativity and brainstorming skills which can increase their engagement with their learning material in the classroom.,2
426,37.2899,-77.29,4,4,3,4,4,5,5,4,3,3,5,3,4,4,4,5,5,5,5,5,4,4,5,3,5,5,4,3,4,3,3,3,2,2,2,3,3,3,3,2,4,4,5,5,5,3,1,4,3,,5,For the most part but so many people aren't as trusting of it as I am.,1
244,39.9401,-82.8965,5,5,5,5,4,5,5,4,3,5,4,5,4,3,5,2,5,5,5,5,4,5,4,5,5,4,5,5,4,5,5,5,5,1,5,5,4,4,5,5,5,4,5,4,5,1,2,1,5,,2,It helps me and the teachers actually understand what the kids are being taught and what we teach the students is something’s were also learning,1
373,36.3402,-79.6622,2,3,3,5,3,2,3,2,3,4,3,4,4,3,3,2,3,1,2,4,3,1,3,2,4,3,4,5,5,5,1,2,2,2,3,3,3,3,5,5,4,5,5,4,5,1,2,,2,,3,I’m literally using AI to will make the kids were interested in being in class gives him something more to work with more tools and more technology for the new learn it better than the future,3
263,46.0965,-64.8007,4,4,3,3,4,4,4,5,5,5,5,5,5,5,5,5,5,5,5,5,5,5,5,5,5,5,5,4,4,4,4,4,5,5,4,4,4,4,3,2,2,2,4,4,4,1,2,1,5,,2,Education should evolve with the times. Students now know how to use it so ensuring they are aware of the dangers as well as the uses is important.,4
742,41.2969,-95.9674,5,5,5,5,5,5,5,5,2,1,3,3,2,5,5,5,3,5,5,5,5,3,5,5,5,5,4,3,3,3,5,3,3,4,5,1,3,3,5,2,4,3,2,3,2,1,1,,11,,5,Making it more personal each person should have there own avatar,4
762,37.2555,-80.0531,4,4,4,5,4,3,3,3,3,2,4,3,3,4,3,4,4,3,4,3,3,4,4,3,4,4,3,4,4,4,3,3,3,3,3,4,4,4,3,4,3,4,4,3,4,1,1,1,4,,3,"If done right, it could allow for better collaboration in coding",4
401,40.3172,-74.4304,4,4,4,4,4,3,3,4,2,3,2,3,4,5,5,5,3,4,4,4,3,4,4,4,3,4,4,4,4,4,3,3,2,3,3,3,3,3,4,3,4,4,3,3,3,4,1,2,8,,5,"I TEACH IN AN ONLINE ENVIRONMENT, SO AI TOOLS WOULD ENHANCE.",4
708,50.429,-104.5341,2,1,3,2,3,4,1,1,1,1,1,1,1,3,3,1,1,1,1,1,1,1,1,1,1,1,3,3,3,3,5,4,4,5,1,1,1,1,1,1,1,1,1,1,1,1,1,3,3,,5,It won't ,3
1230,38.5423,-89.9588,4,4,4,3,4,3,4,3,3,3,2,3,2,5,3,4,4,3,4,4,4,3,4,4,3,3,3,4,4,3,4,4,3,4,2,4,3,4,4,3,4,3,4,4,4,1,1,4,6,,5,The possible to generate better pot slide and image ,3
2301,40.793,-74.0247,5,5,5,5,4,5,5,5,3,3,4,3,5,5,5,5,3,5,4,4,3,3,3,3,3,5,5,5,5,1,3,4,4,4,1,1,1,1,5,3,4,5,3,3,3,1,1,1,4,,3,,3
389,43.7489,-79.4422,5,5,4,4,5,1,2,3,2,2,2,2,2,5,5,5,2,2,2,2,2,2,2,2,2,3,3,2,2,1,5,5,5,5,1,2,1,1,4,3,2,2,1,2,2,1,2,4,5,,3,I’m not sure they coul,4
561,51.0406,-114.0764,4,4,4,5,4,2,3,2,3,3,4,3,4,4,4,4,4,5,4,4,4,4,4,4,4,4,4,4,4,2,2,4,4,4,4,4,4,4,2,4,4,4,4,4,4,3,2,1,7,,3,They will become more confident and have the ability to succeed in the future.,4
198,46.3978,-63.7825,4,4,2,2,2,3,2,3,2,3,3,3,4,4,3,4,2,3,3,5,2,1,2,4,4,2,4,4,3,3,4,3,3,4,2,4,4,2,4,4,3,2,4,3,3,2,2,2,11,,3,Easily,1
205,43.8189,-71.059,5,5,5,5,5,5,5,5,4,3,3,3,3,4,3,3,5,4,4,4,5,5,5,5,4,4,5,5,5,4,4,5,4,4,3,3,3,3,4,4,4,4,4,4,4,1,2,1,3,,2,students may be more eager to try these things out as its new and exciting,3
212,35.1996,-84.8525,2,3,1,3,3,3,1,3,3,3,1,5,4,1,2,3,2,3,1,4,4,4,3,3,4,2,2,3,4,1,4,3,2,4,3,2,3,4,4,3,1,4,5,3,4,1,1,1,4,,3,I think more hands on learning is ideal for our future.,2
1785,52.1413,-106.6076,4,5,4,5,4,4,5,4,2,3,3,3,2,4,5,4,4,3,3,4,4,3,4,4,3,5,4,3,4,4,4,4,3,5,4,3,3,2,4,3,4,3,4,3,5,1,1,2,2,,2,These days students are interested in technology so using AI is one of the things that attracts them,3
130,39.1094,-84.5718,4,2,3,3,3,2,4,2,4,4,4,4,5,4,4,3,4,4,4,4,5,4,4,4,4,4,4,5,4,3,5,2,4,4,3,4,3,5,4,4,3,4,5,4,2,1,1,1,8,,3,Exceptional service ,2
294,45.5191,-73.462,4,4,4,4,4,4,4,3,3,2,2,3,2,4,4,4,3,3,3,2,3,4,3,3,2,3,3,3,3,4,5,3,4,3,2,3,3,3,4,2,2,3,3,2,2,2,1,2,5,,5,GOOD OR BAD WE ARE NOT YET THERE,2
261,43.2262,-79.8621,4,4,3,4,3,3,3,4,3,3,2,3,3,3,3,3,4,4,3,3,3,4,4,3,4,4,3,3,4,3,3,3,3,3,5,4,4,5,3,3,5,3,4,4,3,1,1,3,7,,3,its the future so i think everyone should learn how to use it and understand it ,3
279,38.9307,-77.1673,4,4,4,5,4,3,3,4,1,1,1,1,1,3,3,3,2,2,2,3,2,3,3,3,4,3,2,2,3,3,5,5,5,5,3,3,4,3,3,2,2,2,2,2,2,3,1,4,5,,5,It may aid in background research,1
402,45.5599,-73.5691,5,5,5,5,5,5,5,5,4,4,5,4,4,5,5,5,5,5,5,5,5,5,5,5,5,5,5,5,5,5,4,4,5,4,3,5,5,5,5,5,5,5,5,5,5,2,1,2,4,,5,Students always use Generative AI for learning process ,1
340,45.7283,-73.7071,4,4,3,3,4,4,4,4,3,3,3,4,4,4,3,4,4,4,3,4,4,4,4,4,3,4,4,4,4,4,3,3,3,2,3,4,4,3,4,4,4,4,4,4,4,1,2,3,3,,5,More interactive and fun for student,3
204,38.3792,-75.6307,4,5,4,5,4,4,3,5,4,5,4,5,4,4,5,4,4,4,3,5,4,5,4,5,5,4,4,5,4,1,3,2,1,1,5,4,5,4,5,5,5,5,4,5,3,2,1,2,3,,5,It would help them focus on leadership skills in the industry ,1
413,48.7808,-123.7037,4,4,4,4,4,2,4,4,3,3,4,2,4,4,4,4,4,3,4,4,3,4,4,3,4,4,4,4,3,4,4,4,3,4,4,4,4,2,4,4,2,4,3,4,3,3,1,2,1,,5,"Using AI  they can use computers to help put together pieces of history from a great many sources and help formulate a reasonable hypothesis of events , quicker and more efficient than by hand",1
578,43.8018,-79.3581,4,4,3,2,3,3,4,3,2,2,1,2,2,2,2,4,3,4,3,3,4,4,4,3,4,4,3,3,3,3,4,4,3,3,3,3,4,3,2,1,2,2,3,4,4,2,2,3,5,,5,Help generate order in structure of research and search strategies,3
154,32.7368,-96.9068,3,3,3,3,3,2,3,3,1,1,1,1,1,1,3,3,1,1,3,3,1,1,1,3,3,3,1,1,1,1,5,5,5,5,1,1,1,1,1,3,3,3,1,1,3,2,2,1,3,,5,It wont,1
333,32.2871,-90.2306,4,3,2,3,4,2,3,2,2,2,2,1,1,4,4,4,2,2,3,2,3,3,3,3,4,3,4,4,4,4,4,5,3,4,3,3,3,3,4,2,3,4,3,3,3,2,2,3,8,,5,by providing real-time student data on assessments and recommending course of action for remediation,4
262,43.1234,-77.7334,1,1,1,1,1,3,3,3,1,1,1,1,1,4,4,2,3,2,3,2,3,3,3,3,2,3,3,3,3,3,4,4,5,4,3,3,3,3,2,1,2,1,1,1,1,2,1,2,1,,3,I am not very familiar with Generative AI Tools,4
284,42.3465,-85.2185,4,4,4,3,3,4,5,3,4,4,4,3,4,4,4,3,4,4,4,4,4,3,5,4,3,4,4,4,4,4,4,4,4,4,4,4,3,4,2,2,2,3,4,4,4,1,1,1,2,,2,Get students to ask more insightful questions ,3
358,40.7641,-74.1654,4,4,4,4,4,5,5,5,4,4,4,4,4,4,4,4,5,5,4,5,4,4,5,4,4,5,5,4,4,4,5,5,5,5,4,5,5,5,5,5,4,4,4,5,5,2,1,2,4,,4,"This tool helps me beyond measure, it helps me throughout the day ",2
587,25.9436,-80.2264,3,3,3,3,5,4,4,4,3,3,4,3,4,4,4,4,3,4,4,4,4,4,4,4,4,4,3,3,4,4,4,4,3,2,4,4,5,5,3,3,4,4,5,5,5,4,2,2,5,,5,It will allow for better use of time as AI takes a majority of contextual work.,4
268,33.3661,-111.9345,3,3,4,5,2,2,2,2,5,3,2,4,4,3,5,4,2,4,5,5,3,3,4,3,1,1,3,4,2,4,4,4,5,4,3,4,2,5,2,3,1,4,3,4,4,1,1,2,5,,4,It saves time.,2
423,49.9514,-97.1133,5,5,4,4,4,4,3,3,3,3,3,3,3,4,4,4,3,3,3,3,4,3,3,3,4,4,5,5,5,5,5,5,5,5,3,2,4,1,4,3,4,4,4,4,4,2,2,4,2,,5,I'm not sure that my answer is the one who seem to be hinting at wanting. We are divided both within my department and across other departments in evaluating the necessity of increasing AI. ,1
322,38.6096,-121.4443,5,5,4,5,5,4,4,4,4,4,4,4,4,5,4,4,4,5,4,4,5,4,5,4,5,5,4,5,4,4,3,3,4,3,4,4,4,4,4,4,5,5,4,4,4,2,1,1,7,,2,It could answer simple questions that individuals may have and reduce rime spent on simple tasks,4
250,32.5618,-88.8777,3,2,2,1,2,5,1,3,4,3,2,2,4,3,2,2,3,1,2,4,4,2,2,4,2,2,4,2,2,3,5,2,2,4,4,3,2,2,3,2,5,1,4,2,2,1,2,1,6,,4,i like it ,1
261,33.8019,-84.3861,4,5,4,5,5,4,4,4,5,4,4,3,4,5,4,5,4,4,4,5,5,4,5,5,4,4,5,5,4,4,5,5,4,4,4,4,5,4,5,5,4,5,5,4,4,2,2,2,2,,2,AI help students prepare for exams ,4
375,33.9422,-118.0347,4,4,4,4,4,1,1,3,1,1,1,1,1,5,4,3,3,3,3,1,1,1,3,1,1,1,5,5,5,5,3,5,5,5,1,1,3,1,2,1,4,3,1,1,1,3,1,4,6,,5,Students prefer to interact with humans and human-generated content.,1
197,28.8064,-81.8869,5,5,5,4,5,5,5,4,5,4,5,5,4,5,5,4,5,5,5,4,4,5,5,5,4,5,4,5,5,2,1,2,1,1,5,4,5,5,5,5,5,4,4,5,5,2,1,2,4,,3,Chat gpt is the future to teach and learn,3
134,34.4179,-117.3064,3,4,3,3,4,3,2,3,3,3,3,3,3,2,2,2,3,2,3,3,2,3,3,3,3,2,3,2,3,3,2,3,3,3,2,3,3,2,2,3,3,2,2,3,3,1,2,3,3,,4,Have no idea,4
368,31.7703,-106.3006,4,4,2,3,4,2,3,4,1,3,1,1,1,2,2,4,5,4,4,4,2,4,1,1,4,4,4,3,3,2,4,5,4,5,3,2,2,2,2,2,2,2,4,4,4,1,2,2,1,,1,I teach poetry and it's fun to give bing chat gpt the same in class prompt as the students.,4
162,42.1297,-80.0624,5,5,5,5,5,5,5,4,4,4,3,4,4,5,5,4,5,5,5,4,5,5,4,4,5,5,3,5,5,5,1,1,2,2,5,5,4,4,5,5,4,5,5,5,4,2,2,1,4,,3,If you have any questions or concerns please feel free ,1
513,43.7922,-79.1523,5,3,4,4,5,5,4,4,5,4,5,5,5,4,3,4,5,4,4,5,5,2,5,5,5,5,5,5,4,2,5,4,5,4,5,5,5,3,5,4,3,5,4,5,4,1,2,3,5,,2,Limit the use but use it for fun ,3
168,41.8883,-87.7613,4,4,4,4,4,4,4,4,3,4,3,4,4,4,3,4,4,4,4,4,3,3,4,4,4,4,4,4,3,4,4,4,4,4,4,4,4,4,3,4,4,4,4,4,4,1,1,1,8,,2,It can help them better understand the lesson that is being taught ,1
380,43.9228,-78.8693,4,4,5,4,4,4,4,5,5,4,3,4,4,4,4,5,4,5,3,4,5,4,4,5,4,5,4,4,4,4,5,4,4,4,4,4,3,4,4,4,5,4,3,5,4,1,2,1,8,,3,It can make creative project for student to to do in class which can be beneficial for incorporating several components of the curriculum. ,1
285,45.1563,-113.8886,4,4,4,4,5,5,5,4,4,3,4,3,4,4,4,4,5,5,5,5,5,4,5,4,3,5,5,5,5,5,4,4,4,4,4,4,4,4,5,4,4,4,5,5,5,2,1,2,2,,4,It’ll get them too be more involved and hands on if they have more confidence,1
301,41.9215,-87.6446,5,5,4,5,5,4,3,2,1,1,4,3,4,3,3,4,3,4,2,2,4,3,3,3,2,3,4,4,3,1,5,5,5,5,2,2,2,1,4,4,5,4,2,3,3,2,2,3,2,,2,"I think that using generative AI to create ""gamified"" assignments that encourage student engagement with the material and promote healthy competition could help to create more retention and understanding.",4
109,43.5639,-79.7172,4,4,4,4,4,4,4,4,4,3,3,4,4,4,3,4,4,4,3,4,4,3,4,2,5,3,5,3,4,4,4,5,4,4,5,4,3,4,5,2,4,4,4,3,4,2,2,2,8,,4,It saves time ,3
186,43.648,-79.4141,4,4,4,2,3,1,1,1,1,1,1,1,1,3,2,1,1,1,1,1,1,1,1,1,1,1,4,5,4,4,3,5,5,5,3,2,4,2,2,1,4,2,1,1,1,1,2,2,5,,2,I really don't see a benefit,4
607,33.8019,-84.3861,1,3,3,4,3,2,4,4,2,2,2,2,2,2,5,3,3,2,2,2,3,4,3,4,4,4,4,4,4,4,3,3,4,4,2,1,1,1,3,2,2,2,4,3,3,1,1,1,1,,3,I dont think it willl,4
419,29.675,-95.486,3,4,5,5,4,5,5,5,4,4,3,4,4,4,4,4,5,4,5,5,4,4,5,5,5,4,4,4,4,4,4,4,4,4,4,1,4,5,4,4,4,5,4,5,5,2,2,2,2,,3,Very good ,2
364,42.5144,-90.693,5,4,4,3,4,2,3,2,1,2,1,1,2,5,4,3,3,4,3,2,3,2,2,3,1,2,4,4,4,3,5,5,5,4,4,1,3,1,3,1,1,4,2,1,2,2,1,2,1,,5,I think it could be beneficial in generating immediate feedback in asynchronous online courses.,2
266,43.4325,-80.4995,2,2,1,2,1,1,2,1,2,2,3,4,3,4,5,4,4,5,4,5,5,5,4,4,5,5,4,5,4,4,5,5,4,4,2,2,2,4,4,2,4,3,4,4,3,1,1,4,9,,2,It could streamline the learning system and help tailor a system best suited to my students needs.,1
235,32.7368,-96.9068,3,2,3,2,4,1,1,1,1,1,1,1,1,4,3,3,1,1,2,1,1,1,1,1,1,1,3,3,3,4,4,5,5,5,2,2,2,1,3,3,3,3,1,1,1,1,1,4,1,,5,I don’t ,2
227,46.8743,-71.2803,2,4,3,2,2,2,2,2,1,1,1,1,1,1,2,2,2,2,2,2,3,3,2,2,3,2,1,2,2,3,4,4,4,5,2,2,2,2,4,2,3,2,2,3,2,1,2,3,3,,5,Its easy for them to find answers,3
290,26.5331,-80.1423,4,4,3,5,5,4,4,2,3,2,4,3,3,4,4,4,3,4,5,2,4,4,4,4,2,4,1,2,2,2,5,5,5,5,3,4,3,3,4,2,4,5,4,4,4,2,1,3,9,,5,"I am not sure yet, it is too new",2
263,40.0364,-75.2219,5,5,5,4,5,4,4,4,4,4,3,2,2,5,5,5,4,5,5,4,5,4,4,4,5,3,4,4,5,3,5,4,3,5,3,4,3,5,4,2,4,4,5,4,5,2,2,4,7,,5,"I see it as a way of helping them develop critical thinking and evaluation tools, and it is very useful to do this as a collaborative activity.",4
440,42.3531,-71.0958,4,4,4,3,4,4,4,4,3,2,3,2,3,4,3,4,4,4,4,4,4,4,3,4,4,4,4,4,4,4,5,5,5,5,3,4,4,4,4,4,4,4,4,4,4,2,2,4,6,,5,It’s modern and they can do many tasks using it. ,1
315,30.7131,-88.0857,5,5,5,5,4,5,5,5,4,4,4,5,4,5,4,5,5,5,5,5,5,5,5,5,5,5,5,5,5,5,2,3,3,3,4,5,4,5,5,5,4,5,5,5,5,1,1,3,7,,5,The ability to show my students in actual form is amazing. ,3
162,43.4051,-79.7214,4,4,4,4,4,4,4,4,3,4,4,3,4,4,4,3,4,4,4,4,5,5,4,4,4,4,5,4,5,2,4,2,2,3,3,3,3,4,4,4,4,4,5,5,5,2,2,2,4,,4,Innovative ,1
212,49.1906,-122.9344,3,3,2,3,4,3,3,3,3,2,2,2,3,2,3,3,3,2,2,2,3,3,2,3,3,3,2,2,2,2,4,5,5,4,3,3,3,3,2,1,2,3,4,3,4,2,1,2,1,,5,It can make assessment feedback an ongoing and more rapid process,4
475,43.9282,-105.5492,5,5,5,4,5,5,5,5,4,5,5,5,5,5,5,5,5,5,4,5,5,5,5,4,5,5,5,5,5,4,5,5,5,4,5,5,5,5,5,5,3,4,5,4,5,1,1,3,4,,4,It will enable better understanding for students,2
454,37.3612,-79.1469,4,4,4,4,4,4,4,4,4,3,2,2,4,4,3,3,4,4,4,4,4,4,4,4,4,4,4,4,4,4,4,3,3,4,4,4,3,4,4,4,5,4,4,4,4,2,2,2,1,,4,"GAI tools will alow me more time to do the important tasks, like actual teaching",4
349,45.4446,-75.6385,4,5,4,5,4,5,5,4,4,4,5,4,5,5,5,5,5,4,5,4,4,4,5,4,5,4,5,5,4,2,5,4,1,5,5,4,5,4,4,5,4,5,5,4,3,2,2,3,4,,4,its necessary for to obtain more opportunities for the future,2
128,53.5546,-113.3014,5,3,3,3,5,5,3,4,5,3,4,5,5,5,4,5,5,4,5,4,5,4,4,4,5,5,5,5,4,5,5,3,5,5,5,5,3,4,5,4,4,4,5,4,5,1,1,2,2,,3,By helping students find answers easier,2
